,nature,type,id,description,cwe_counts
686,ParentOf,base,823,Use of Out-of-range Pointer Offset,111
687,ParentOf,base,824,Access of Uninitialized Pointer,148
688,ParentOf,base,825,Expired Pointer Dereference,111
689,ParentOf,base,829,Inclusion of Functionality from Untrusted Control Sphere,70
690,ParentOf,base,832,Unlock of a Resource that is not Locked,7
691,ParentOf,base,833,Deadlock,14
692,ParentOf,base,843,Access of Resource Using Incompatible Type ('Type Confusion'),36
693,ParentOf,base,88,Improper Neutralization of Argument Delimiters in a Command ('Argument Injection'),222
694,ParentOf,base,89,Improper Neutralization of Special Elements used in an SQL Command ('SQL Injection'),30
695,ParentOf,base,908,Use of Uninitialized Resource,46
696,ParentOf,base,91,XML Injection (aka Blind XPath Injection),60
697,ParentOf,base,914,Improper Control of Dynamically-Identified Variables,2
698,ParentOf,base,915,Improperly Controlled Modification of Dynamically-Determined Object Attributes,2
699,ParentOf,base,916,Use of Password Hash With Insufficient Computational Effort,3
700,ParentOf,base,917,Improper Neutralization of Special Elements used in an Expression Language Statement ('Expression Language Injection'),222
701,ParentOf,base,918,Server-Side Request Forgery (SSRF),1
702,ParentOf,base,920,Improper Restriction of Power Consumption,430
703,ParentOf,base,921,Storage of Sensitive Data in a Mechanism without Access Control,56
704,ParentOf,base,924,Improper Enforcement of Message Integrity During Transmission in a Communication Channel,138
705,ParentOf,base,93,Improper Neutralization of CRLF Sequences ('CRLF Injection'),30
706,ParentOf,base,939,Improper Authorization in Handler for Custom URL Scheme,4
707,ParentOf,base,94,Improper Control of Generation of Code ('Code Injection'),62
708,ParentOf,base,940,Improper Verification of Source of a Communication Channel,8
709,ParentOf,base,96,Improper Neutralization of Directives in Statically Saved Code ('Static Code Injection'),94
710,ParentOf,chain,680,Integer Overflow to Buffer Overflow,228
711,ParentOf,chain,690,Unchecked Return Value to NULL Pointer Dereference,6
712,ParentOf,class,1023,Incomplete Comparison with Missing Factors,66
713,ParentOf,class,1039,Automated Recognition Mechanism with Inadequate Detection or Handling of Adversarial Input Perturbations,109
714,ParentOf,class,114,Process Control,437
715,ParentOf,class,119,Improper Restriction of Operations within the Bounds of a Memory Buffer,436
716,ParentOf,class,1263,Improper Physical Access Control,17
717,ParentOf,class,1294,Insecure Security Identifier Mechanism,17
718,ParentOf,class,1390,Weak Authentication,2
719,ParentOf,class,1419,Incorrect Initialization of Resource,23
720,ParentOf,class,185,Incorrect Regular Expression,66
721,ParentOf,class,200,Exposure of Sensitive Information to an Unauthorized Actor,14
722,ParentOf,class,269,Improper Privilege Management,17
723,ParentOf,class,271,Privilege Dropping / Lowering Errors,7
724,ParentOf,class,282,Improper Ownership Management,17
725,ParentOf,class,285,Improper Authorization,34
726,ParentOf,class,286,Incorrect User Management,17
727,ParentOf,class,287,Improper Authentication,34
728,ParentOf,class,311,Missing Encryption of Sensitive Data,43
729,ParentOf,class,326,Inadequate Encryption Strength,43
730,ParentOf,class,327,Use of a Broken or Risky Cryptographic Algorithm,43
731,ParentOf,class,330,Use of Insufficiently Random Values,43
732,ParentOf,class,345,Insufficient Verification of Data Authenticity,43
733,ParentOf,class,346,Origin Validation Error,155
734,ParentOf,class,377,Insecure Temporary File,14
735,ParentOf,class,402,Transmission of Private Resources into a New Sphere ('Resource Leak'),14
736,ParentOf,class,405,Asymmetric Resource Consumption (Amplification),215
737,ParentOf,class,424,Improper Protection of Alternate Path,43
738,ParentOf,class,441,Unintended Proxy or Intermediary ('Confused Deputy'),1
739,ParentOf,class,522,Insufficiently Protected Credentials,16
740,ParentOf,class,602,Client-Side Enforcement of Server-Side Security,43
741,ParentOf,class,636,Not Failing Securely ('Failing Open'),12
742,ParentOf,class,638,Not Using Complete Mediation,4
743,ParentOf,class,642,External Control of Critical State Data,14
744,ParentOf,class,653,Improper Isolation or Compartmentalization,43
745,ParentOf,class,655,Insufficient Psychological Acceptability,43
746,ParentOf,class,656,Reliance on Security Through Obscurity,43
747,ParentOf,class,667,Improper Locking,28
748,ParentOf,class,732,Incorrect Permission Assignment for Critical Resource,23
749,ParentOf,class,75,Failure to Sanitize Special Elements into a Different Plane (Special Element Injection),30
750,ParentOf,class,77,Improper Neutralization of Special Elements used in a Command ('Command Injection'),60
751,ParentOf,class,862,Missing Authorization,26
752,ParentOf,class,863,Incorrect Authorization,26
753,ParentOf,class,909,Missing Initialization of Resource,46
754,ParentOf,class,923,Improper Restriction of Communication Channel to Intended Endpoints,17
755,ParentOf,class,943,Improper Neutralization of Special Elements in Data Query Logic,30
756,ParentOf,class,99,Improper Control of Resource Identifiers ('Resource Injection'),30
757,ParentOf,composite,352,Cross-Site Request Forgery (CSRF),138
758,ParentOf,composite,384,Session Fixation,2
759,ParentOf,composite,689,Permission Race Condition During Resource Copy,10
760,ParentOf,variant,102,Struts: Duplicate Validation Forms,436
761,ParentOf,variant,103,Struts: Incomplete validate() Method Definition,436
762,ParentOf,variant,104,Struts: Form Bean Does Not Extend Validation Class,436
763,ParentOf,variant,105,Struts: Form Field Without Validator,436
764,ParentOf,variant,106,Struts: Plug-in Framework not in Use,436
765,ParentOf,variant,107,Struts: Unused Validation Form,436
766,ParentOf,variant,1077,Floating Point Comparison with Incorrect Operator,66
767,ParentOf,variant,108,Struts: Unvalidated Action Form,436
768,ParentOf,variant,109,Struts: Validator Turned Off,436
769,ParentOf,variant,1096,Singleton Class Instance Creation without Proper Locking or Synchronization,14
770,ParentOf,variant,110,Struts: Validator Without Form Field,436
771,ParentOf,variant,111,Direct Use of Unsafe JNI,436
772,ParentOf,variant,113,Improper Neutralization of CRLF Sequences in HTTP Headers ('HTTP Request/Response Splitting'),437
773,ParentOf,variant,121,Stack-based Buffer Overflow,247
774,ParentOf,variant,122,Heap-based Buffer Overflow,247
775,ParentOf,variant,126,Buffer Over-read,365
776,ParentOf,variant,127,Buffer Under-read,365
777,ParentOf,variant,129,Improper Validation of Array Index,436
778,ParentOf,variant,1321,Improperly Controlled Modification of Object Prototype Attributes ('Prototype Pollution'),4
779,ParentOf,variant,1385,Missing Origin Validation in WebSockets,8
780,ParentOf,variant,192,Integer Coercion Error,33
781,ParentOf,variant,194,Unexpected Sign Extension,99
782,ParentOf,variant,195,Signed to Unsigned Conversion Error,99
783,ParentOf,variant,196,Unsigned to Signed Conversion Error,99
784,ParentOf,variant,234,Failure to Handle Missing Parameter,5
785,ParentOf,variant,235,Improper Handling of Extra Parameters,5
786,ParentOf,variant,236,Improper Handling of Undefined Parameters,5
787,ParentOf,variant,24,Path Traversal: '../filedir',5
788,ParentOf,variant,243,Creation of chroot Jail Without Changing Working Directory,35
789,ParentOf,variant,25,Path Traversal: '/../filedir',5
790,ParentOf,variant,26,Path Traversal: '/dir/../filename',5
791,ParentOf,variant,27,Path Traversal: 'dir/../../filename',5
792,ParentOf,variant,28,Path Traversal: '..\filedir',5
793,ParentOf,variant,29,Path Traversal: '\..\filename',5
794,ParentOf,variant,291,Reliance on IP Address for Authentication,3
795,ParentOf,variant,297,Improper Validation of Certificate with Host Mismatch,1
796,ParentOf,variant,298,Improper Validation of Certificate Expiration,1
797,ParentOf,variant,30,Path Traversal: '\dir\..\filename',5
798,ParentOf,variant,31,Path Traversal: 'dir\..\..\filename',5
799,ParentOf,variant,32,Path Traversal: '...' (Triple Dot),5
800,ParentOf,variant,33,Path Traversal: '....' (Multiple Dot),5
801,ParentOf,variant,332,Insufficient Entropy in PRNG,1
802,ParentOf,variant,333,Improper Handling of Insufficient Entropy in TRNG,13
803,ParentOf,variant,34,Path Traversal: '....//',5
804,ParentOf,variant,35,Path Traversal: '.../...//',5
805,ParentOf,variant,37,Path Traversal: '/absolute/pathname/here',3
806,ParentOf,variant,38,Path Traversal: '\absolute\pathname\here',3
807,ParentOf,variant,39,Path Traversal: 'C:dirname',3
808,ParentOf,variant,40,Path Traversal: '\\UNC\share\name\' (Windows UNC Share),3
809,ParentOf,variant,456,Missing Initialization of a Variable,46
810,ParentOf,variant,457,Use of Uninitialized Variable,89
811,ParentOf,variant,467,Use of sizeof() on a Pointer Type,60
812,ParentOf,variant,473,PHP External Variable Modification,3
813,ParentOf,variant,491,Public cloneable() Method Without Final ('Object Hijack'),14
814,ParentOf,variant,492,Use of Inner Class Containing Sensitive Data,14
815,ParentOf,variant,493,Critical Public Variable Without Final Modifier,14
816,ParentOf,variant,498,Cloneable Class Containing Sensitive Information,14
817,ParentOf,variant,499,Serializable Class Containing Sensitive Data,14
818,ParentOf,variant,543,Use of Singleton Pattern Without Synchronization in a Multithreaded Context,14
819,ParentOf,variant,550,Server-generated Error Message Containing Sensitive Information,3
820,ParentOf,variant,564,SQL Injection: Hibernate,39
821,ParentOf,variant,568,finalize() Method Without super.finalize(),2
822,ParentOf,variant,581,Object Model Violation: Just One of Equals and Hashcode Defined,66
823,ParentOf,variant,582,"Array Declared Public, Final, and Static",14
824,ParentOf,variant,583,finalize() Method Declared Public,14
825,ParentOf,variant,588,Attempt to Access Child of a Non-structure Pointer,18
826,ParentOf,variant,598,Use of GET Request Method With Sensitive Query Strings,1
827,ParentOf,variant,599,Missing Validation of OpenSSL Certificate,1
828,ParentOf,variant,600,Uncaught Exception in Servlet,1
829,ParentOf,variant,607,Public Static Final Field References Mutable Object,3
830,ParentOf,variant,608,Struts: Non-private Field in ActionForm Class,14
831,ParentOf,variant,616,Incomplete Identification of Uploaded File Variables (PHP),69
832,ParentOf,variant,618,Exposed Unsafe ActiveX Method,1
833,ParentOf,variant,622,Improper Validation of Function Hook Arguments,436
834,ParentOf,variant,646,Reliance on File Name or Extension of Externally-Supplied File,69
835,ParentOf,variant,647,Use of Non-Canonical URL Paths for Authorization Decisions,3
836,ParentOf,variant,759,Use of a One-Way Hash without a Salt,1
837,ParentOf,variant,760,Use of a One-Way Hash with a Predictable Salt,1
838,ParentOf,variant,774,Allocation of File Descriptors or Handles Without Limits or Throttling,74
839,ParentOf,variant,780,Use of RSA Algorithm without OAEP,3
840,ParentOf,variant,782,Exposed IOCTL with Insufficient Access Control,1
841,ParentOf,variant,785,Use of Path Manipulation Function without Maximum-sized Buffer,561
842,ParentOf,variant,789,Memory Allocation with Excessive Size Value,74
843,ParentOf,variant,8,J2EE Misconfiguration: Entity Bean Declared Remote,14
844,ParentOf,variant,80,Improper Neutralization of Script-Related HTML Tags in a Web Page (Basic XSS),116
845,ParentOf,variant,81,Improper Neutralization of Script in an Error Message Web Page,116
846,ParentOf,variant,83,Improper Neutralization of Script in Attributes in a Web Page,116
847,ParentOf,variant,84,Improper Neutralization of Encoded URI Schemes in a Web Page,116
848,ParentOf,variant,85,Doubled Character XSS Manipulations,116
849,ParentOf,variant,86,Improper Neutralization of Invalid Characters in Identifiers in Web Pages,116
850,ParentOf,variant,87,Improper Neutralization of Alternate XSS Syntax,116
851,ParentOf,variant,926,Improper Export of Android Application Components,9
852,ParentOf,variant,927,Use of Implicit Intent for Sensitive Communication,23
853,ParentOf,variant,942,Permissive Cross-domain Policy with Untrusted Domains,3
854,ParentOf,variant,95,Improper Neutralization of Directives in Dynamically Evaluated Code ('Eval Injection'),94
855,PeerOf,base,123,Write-what-where Condition,14
856,PeerOf,base,128,Wrap-around Error,228
857,PeerOf,base,1287,Improper Validation of Specified Type of Input,44
858,PeerOf,base,1295,Debug Messages Revealing Unnecessary Information,3
859,PeerOf,base,1304,Improperly Preserved Integrity of Hardware Configuration State During a Power Save/Restore Operation,69
860,PeerOf,base,1325,Improperly Controlled Sequential Memory Allocation,4
861,PeerOf,base,1339,Insufficient Precision or Accuracy of a Real Number,228
862,PeerOf,base,273,Improper Check for Dropped Privileges,6
863,PeerOf,base,301,Reflection Attack in an Authentication Protocol,3
864,PeerOf,base,322,Key Exchange without Entity Authentication,1
865,PeerOf,base,351,Insufficient Type Distinction,16
866,PeerOf,base,353,Missing Support for Integrity Check,8
867,PeerOf,base,386,Symbolic Name not Mapping to Correct Object,13
868,PeerOf,base,426,Untrusted Search Path,4
869,PeerOf,base,427,Uncontrolled Search Path Element,10
870,PeerOf,base,428,Unquoted Search Path or Element,10
871,PeerOf,base,430,Deployment of Wrong Handler,16
872,PeerOf,base,502,Deserialization of Untrusted Data,2
873,PeerOf,base,603,Use of Client-Side Authentication,11
874,PeerOf,base,79,Improper Neutralization of Input During Web Page Generation ('Cross-site Scripting'),27
875,PeerOf,base,915,Improperly Controlled Modification of Dynamically-Determined Object Attributes,213
876,PeerOf,base,917,Improper Neutralization of Special Elements used in an Expression Language Statement ('Expression Language Injection'),4
877,PeerOf,class,20,Improper Input Validation,69
878,PeerOf,class,311,Missing Encryption of Sensitive Data,3
879,PeerOf,class,327,Use of a Broken or Risky Cryptographic Algorithm,4
880,PeerOf,class,345,Insufficient Verification of Data Authenticity,436
881,PeerOf,class,436,Interpretation Conflict,16
882,PeerOf,class,441,Unintended Proxy or Intermediary ('Confused Deputy'),4
883,PeerOf,class,451,User Interface (UI) Misrepresentation of Critical Information,8
884,PeerOf,class,602,Client-Side Enforcement of Server-Side Security,11
885,PeerOf,composite,352,Cross-Site Request Forgery (CSRF),116
886,PeerOf,variant,415,Double Free,87
887,PeerOf,variant,416,Use After Free,14
